### ISSUE TITLE
Ftp FEAT: operation timed out

### ISSUE THREAD

**Issue by han2015** [jlaffaye/ftp#82]
Hi, I track this code caused timed out. if i cancel ServerConn.feat(), ftp could connect server smoothly.
`code, message, err := c.cmd(-1, "FEAT")`
https://github.com/jlaffaye/ftp/blob/master/ftp.go#L97

deeply, i find error was thrown from `reader.ReadResponse`.
`c.conn.ReadResponse(expected)`
https://github.com/jlaffaye/ftp/blob/master/ftp.go#L295

> An expectCode <= 0 disables the check of the status code.
 
as golang doc said,  i cancel this code temporarily. actually i'm not a big fan of `feat` causes connection failed.

Could you give a suggestion.

**Comment by jlaffaye** [comment]
If I understand correctly, the FTP server does not respond to the FEAT command ?
What is this server ? Do you have an IP address so I can check ?

**Comment by han2015** [comment]
Hi @jlaffaye 
Here is the host:  ftp.castle.yahoofs.jp:21. thx

**Comment by jlaffaye** [comment]
Ok so the output is:

```
FEAT
211-Features:
 MDTM
 SSCN
 SIZE
 PROT
 LANG ru-RU;zh-CN;es-ES;en-US*;it-IT;fr-FR;zh-TW;ja-JP;bg-BG;ko-KR
 CCC
 PBSZ
 AUTH TLS
 REST STREAM
 UTF8
 EPRT
 EPSV
211 End
```

I'll have a look tonight

**Comment by jlaffaye** [comment]
I have no error with this server

**Comment by han2015** [comment]
Hi @jlaffaye  
Thanks your checking. it seems the output was printed by ftp terminal on server, right?
I could also connect server with ftp terminal and got same output with **feat**.

but couldn't with "jlaffaye/ftp". maybe someone also give a check, here the test code:
```
package main

import (
	"github.com/jlaffaye/ftp"
)

func main() {
	_, err := ftp.Connect("ftp.castle.yahoofs.jp:21")
	if err != nil {
		panic(err) // it takes long time, then throw a error 'ip:port: read: operation timed out '
	}
	println("success")
}
```

**Comment by corny** [comment]
@han2015 It also works for me - it does not panic. The transmitted data:
```
220 FTP Server ready.
FEAT
211-Features:
 MDTM
 SSCN
 SIZE
 PROT
 LANG ru-RU;zh-CN;es-ES;en-US*;it-IT;fr-FR;zh-TW;ja-JP;bg-BG;ko-KR
 CCC
 PBSZ
 AUTH TLS
 REST STREAM
 UTF8
 EPRT
 EPSV
211 End
```
Try to capture the packets with tcpdump/wireshark. Do you get the same result?

**Comment by han2015** [comment]
@corny ，@jalffaye  thanks for your checking，maybe myself net issue...
but i capture packets and got these output：
```
TCP	66	51599 → ftp(21) [ACK] Seq=1 Ack=1 Win=131360 Len=0 TSval=1073347835 TSecr=796090449
FTP	89	Response: 220 FTP Server ready.
TCP	66	51599 → ftp(21) [ACK] Seq=1 Ack=24 Win=131328 Len=0 TSval=1073347913 TSecr=796090457
FTP	72	Request: FEAT
TCP	72	[TCP Retransmission] 51599 → ftp(21) [PSH, ACK] Seq=1 Ack=24 Win=131328 Len=6 TSval=1073348229 TSecr=796090457
TCP	72	[TCP Retransmission] 51599 → ftp(21) [PSH, ACK] Seq=1 Ack=24 Win=131328 Len=6 TSval=1073348324 TSecr=796090457
TCP	72	[TCP Retransmission] 51599 → ftp(21) [PSH, ACK] Seq=1 Ack=24 Win=131328 Len=6 TSval=1073348944 TSecr=796090457
TCP	72	[TCP Retransmission] 51599 → ftp(21) [PSH, ACK] Seq=1 Ack=24 Win=131328 Len=6 TSval=1073349984 TSecr=796090457
TCP	72	[TCP Retransmission] 51599 → ftp(21) [PSH, ACK] Seq=1 Ack=24 Win=131328 Len=6 TSval=1073351864 TSecr=796090457
TCP	72	[TCP Retransmission] 51599 → ftp(21) [PSH, ACK] Seq=1 Ack=24 Win=131328 Len=6 TSval=1073355425 TSecr=796090457
TCP	72	[TCP Retransmission] 51599 → ftp(21) [PSH, ACK] Seq=1 Ack=24 Win=131328 Len=6 TSval=1073360649 TSecr=796090457
TCP	72	[TCP Retransmission] 51599 → ftp(21) [PSH, ACK] Seq=1 Ack=24 Win=131328 Len=6 TSval=1073370897 TSecr=796090457
TCP	72	[TCP Retransmission] 51599 → ftp(21) [PSH, ACK] Seq=1 Ack=24 Win=131328 Len=6 TSval=1073381145 TSecr=796090457
TCP	72	[TCP Retransmission] 51599 → ftp(21) [PSH, ACK] Seq=1 Ack=24 Win=131328 Len=6 TSval=1073391393 TSecr=796090457
TCP	72	[TCP Retransmission] 51599 → ftp(21) [PSH, ACK] Seq=1 Ack=24 Win=131328 Len=6 TSval=1073401641 TSecr=796090457
TCP	72	[TCP Retransmission] 51599 → ftp(21) [PSH, ACK] Seq=1 Ack=24 Win=131328 Len=6 TSval=1073411889 TSecr=796090457
TCP	72	[TCP Retransmission] 51599 → ftp(21) [PSH, ACK] Seq=1 Ack=24 Win=131328 Len=6 TSval=1073422137 TSecr=796090457
TCP	54	51599 → ftp(21) [RST, ACK] Seq=7 Ack=24 Win=131328 Len=0
TCP	66	[TCP Dup ACK 2#1] ftp(21) → 51599 [ACK] Seq=24 Ack=1 Win=5792 Len=0 TSval=796098919 TSecr=1073347913
TCP	54	51599 → ftp(21) [RST] Seq=1 Win=0 Len=0

```
Will check with my colleagues and give a respond for this issue.
